{
  "id": "persona_01_balanced_sophomore",
  "name": "Balanced Sophomore",
  "version": "0.1.0",
  "summary": "A second-year undergraduate who balances academics, relationships, and health. Default comparison baseline. Tends to seek compromise rather than extreme trade-offs under conflict.",
  "baseline_state": {
    "energy": 6,
    "sleep_debt_hours": 1,
    "stress": 4,
    "physical_stamina": 6,
    "focus_capacity": 6
  },
  "value_priorities": {
    "academic": 0.30,
    "relationships": 0.25,
    "health": 0.20,
    "growth": 0.15,
    "leisure": 0.10
  },
  "communication_style": {
    "assertiveness": 5,
    "directness": 5,
    "preferred_medium": "text",
    "conflict_style": "compromising"
  },
  "relationship_network": [
    {"role": "teammate", "name": "teammate_A", "trust": 7, "closeness": 5, "history_note": "second team project together"},
    {"role": "professor", "name": "prof_assignment", "trust": 6, "closeness": 3},
    {"role": "close_friend_group", "name": "cohort_3", "trust": 8, "closeness": 8}
  ],
  "decision_tendencies": {
    "planning_horizon": "medium",
    "risk_tolerance": 5,
    "procrastination_bias": 4,
    "sleep_discipline": 6
  },
  "daily_routines": [
    {"label": "Tuesday 3h free block", "frequency": "weekly", "duration_minutes": 180},
    {"label": "Light workout", "frequency": "daily", "duration_minutes": 30},
    {"label": "Language study", "frequency": "3x per week", "duration_minutes": 90}
  ]
}
