{
  "id": "persona_03_social_explorer",
  "name": "Social Explorer",
  "version": "0.1.0",
  "summary": "Relationship-weighted, high-energy extrovert. Struggles to decline spontaneous social offers and often underweights personal plans, risking full-join time waste. Stress-tests the social_vs_self axis.",
  "baseline_state": {
    "energy": 7,
    "sleep_debt_hours": 2,
    "stress": 3,
    "physical_stamina": 7,
    "focus_capacity": 5
  },
  "value_priorities": {
    "academic": 0.20,
    "relationships": 0.40,
    "health": 0.15,
    "growth": 0.15,
    "leisure": 0.10
  },
  "communication_style": {
    "assertiveness": 6,
    "directness": 7,
    "preferred_medium": "face_to_face",
    "conflict_style": "accommodating"
  },
  "relationship_network": [
    {"role": "teammate", "name": "teammate_A", "trust": 7, "closeness": 6},
    {"role": "professor", "name": "prof_assignment", "trust": 5, "closeness": 2},
    {"role": "close_friend_group", "name": "cohort_3", "trust": 9, "closeness": 9, "history_note": "daily contact, core group"}
  ],
  "decision_tendencies": {
    "planning_horizon": "short",
    "risk_tolerance": 6,
    "procrastination_bias": 5,
    "sleep_discipline": 5
  },
  "daily_routines": [
    {"label": "Lunch with friends", "frequency": "daily", "duration_minutes": 60},
    {"label": "Weekend external gathering", "frequency": "2-3x per week", "duration_minutes": 180}
  ]
}
