{
  "id": "persona_02_tired_achiever",
  "name": "Tired High-Achiever",
  "version": "0.1.0",
  "summary": "Achievement-driven student with heavy academic weighting, chronic sleep deficit, and avoidance-tilted communication. Prone to miscategorizing hard (irreversible) losses as soft costs.",
  "baseline_state": {
    "energy": 4,
    "sleep_debt_hours": 8,
    "stress": 8,
    "physical_stamina": 4,
    "focus_capacity": 7
  },
  "value_priorities": {
    "academic": 0.55,
    "relationships": 0.10,
    "health": 0.10,
    "growth": 0.20,
    "leisure": 0.05
  },
  "communication_style": {
    "assertiveness": 4,
    "directness": 6,
    "preferred_medium": "async_post",
    "conflict_style": "avoidant"
  },
  "relationship_network": [
    {"role": "teammate", "name": "teammate_A", "trust": 5, "closeness": 3, "history_note": "prefers working alone"},
    {"role": "professor", "name": "prof_assignment", "trust": 8, "closeness": 4, "history_note": "has not used office hours before"},
    {"role": "close_friend_group", "name": "cohort_3", "trust": 6, "closeness": 4}
  ],
  "decision_tendencies": {
    "planning_horizon": "short",
    "risk_tolerance": 7,
    "procrastination_bias": 6,
    "sleep_discipline": 2
  },
  "daily_routines": [
    {"label": "Caffeine (3+ cups)", "frequency": "daily", "duration_minutes": 0},
    {"label": "Late sleep after 01:00", "frequency": "2x+ per week", "duration_minutes": 0}
  ]
}
